{
  "indexVersion": "1.0.0",
  "bundleId": "fixture-evidence-bundle",
  "generatedAt": "2026-08-10T12:00:00Z",
  "core": {
    "currentVersion": "0.2.3",
    "previousVersion": "0.2.2"
  },
  "retention": {
    "retainUntil": "2026-09-16T12:00:00Z",
    "advisory": {
      "status": "review-soon",
      "advisoryOnly": true,
      "deleteAutomatically": false
    }
  },
  "provenance": {
    "sourceTag": "v0.2.3",
    "signature": {
      "status": "unsigned-fixture",
      "verificationPlan": {
        "mode": "detached-signature-verification-plan",
        "status": "fixture-unsigned-not-required",
        "validatesSignatureNow": false
      }
    }
  },
  "contentPolicy": {
    "format": "sanitized-json-index",
    "includeRawEvidence": false,
    "includeSecretValues": false
  },
  "entries": [
    {
      "id": "repo-map-evidence",
      "kind": "evidence-pack",
      "sha256": "00b4ab33a8a926e4252095541478b42b9d1edb132ab0bf29da40a7ba2ebf94a7",
      "expectedStatus": "complete"
    },
    {
      "id": "upgrade-evidence",
      "kind": "adapter-upgrade-evidence",
      "sha256": "0a6c5ad7dbf323a3e950e94cc110d5e2e5fa7388a7784f29bdc931485a22dc8b",
      "expectedStatus": "pass"
    }
  ],
  "changedState": {
    "changed": false,
    "summary": "Archive index fixture is synthetic metadata and does not store raw evidence."
  },
  "recommendedNextAction": "Use this index only as a sanitized locator for bundle review."
}
